Klausimai, kurių tema yra linksmasis išrikiuoti pagal autorių ir taškus
Linksmasis, I, Autorius1, Klausimas1, Atsakymas1, 5, -
Linksmasis, I, Autorius3, Klausimas4, Atsakymas4, 10, Org1.csv
Linksmasis, II, Autorius3, Klausimas8, Atsakymas8, 10, -
Linksmasis, I, Autorius4, Klausimas6, Atsakymas6, 10, Org2.csv
Linksmasis, I, Autorius4, Klausimas1, Atsakymas1, 5, -
Linksmasis, II, Autorius5, Klausimas8, Atsakymas8, 15, PasirinkimasX, PasirinkimasY, PasirinkimasZ, Atsakymas8
Linksmasis, II, Autorius7, Klausimas1, Atsakymas1, 10, Org3.csv
Linksmasis, III, Autorius8, Klausimas7, Atsakymas7, 15, -
